{
  "schema_version": "1.0",
  "profile_id": "llm-default",
  "revision": 1,
  "gateway_image": {
    "reference": "autonomous-worker-egress-gateway",
    "digest": "sha256:cf0fa7f2e762b3613a3eb00f34128830af2a93fbbffd39674d630728bd16146a"
  },
  "internal_network": {
    "gateway_alias": "awf-egress",
    "llm_port": 8443,
    "http_proxy_port": null,
    "direct_egress_denied": true
  },
  "routes": [
    {
      "route_id": "openai-responses",
      "provider_id": "openai",
      "protocol": "openai-responses",
      "upstream_base_url": "https://api.openai.com",
      "worker_base_path": "/v1",
      "worker_auth": {
        "kind": "bearer",
        "header_name": "Authorization",
        "secret_file": "/run/egress/attempt-token"
      },
      "upstream_auth": {
        "kind": "bearer",
        "header_name": "Authorization"
      },
      "secret_handle": "secret://providers/openai-main",
      "models": [
        "gpt-5.2"
      ],
      "request_path_prefixes": [
        "/v1/responses"
      ]
    }
  ],
  "package_proxy": {
    "enabled": false,
    "allowed_hosts": [],
    "allowed_ports": []
  },
  "limits": {
    "max_request_bytes": 8388608,
    "max_response_bytes": 67108864,
    "max_concurrent_requests": 8
  },
  "policy_revision": 1
}
